{
  "schemaVersion": "audit-v7-phase-contract-v1",
  "phase": {
    "sequence": 4,
    "id": "lite-manual-specialist-segment",
    "title": "Lite Combined Phases 2-5 - Manual and Specialist Review",
    "reviewerLineage": "reviewer-2",
    "phaseCard": "phases/phase-4/START_HERE.md"
  },
  "authorization": {
    "controllerBoundCurrentPhaseRequired": true,
    "exactSourceFenceRequired": true,
    "incomingSuccessorReceipt": null,
    "combinedMilestone": "P2_TO_P5",
    "automaticAdvanceAfterSegment": true,
    "humanApprovalRequired": false
  },
  "inputs": {
    "required": [
      "Phase-2 property registry",
      "Phase-3 hypothesis and domain registries",
      "Accepted Source Intelligence identity",
      "Current graph, obligation ledger and invalidation state"
    ],
    "conditional": [
      "Specialist methods for TRIGGERED or UNCERTAIN_INCLUDE domains",
      "Standards proof for an explicit material conformance claim",
      "Formal proof only when necessary to resolve a material property or candidate"
    ]
  },
  "steps": [
    {
      "step": 1,
      "action": "Perform complete source-first manual review",
      "instruction": "Perform one principal source-first semantic traversal using the accepted Source Intelligence map only for orientation. Evaluate implementation behavior while simultaneously recording all applicable EVM, privilege and triggered-domain observations at each source anchor; do not run separate full-source passes per lens.",
      "requirement": "MANDATORY",
      "condition": null,
      "resources": [
        "../../shared/lenses/manual-implementation-lens.md",
        "../../../../shared/domain-modules/evm-contract-review.md",
        "resources/PHASE4_MANUAL_COVERAGE_CANDIDATE_REGISTRY.md"
      ]
    },
    {
      "step": 2,
      "action": "Review privileges and activated domains",
      "instruction": "During that same principal traversal, verify every material privilege path and apply each TRIGGERED or UNCERTAIN_INCLUDE specialist method at the relevant source anchors. Reopen raw source only for a targeted unresolved question or contradiction; do not reclassify unchanged domains.",
      "requirement": "MANDATORY",
      "condition": null,
      "resources": [
        "../../../../shared/domain-modules/governance-privileges.md",
        "../../shared/controller/DOMAIN_APPLICABILITY_REGISTRY.json"
      ]
    },
    {
      "step": 3,
      "action": "Reconcile coverage and continue",
      "instruction": "Represent each material observation as a candidate, evidence-backed non-issue or typed limitation; create Lite 6-7 validation obligations and continue to Phase 5 without a separate report or duplicate seal.",
      "requirement": "MANDATORY",
      "condition": null,
      "resources": [
        "resources/PHASE4_MANUAL_COVERAGE_CANDIDATE_REGISTRY.md",
        "../../shared/controller/SECURITY_TRACEABILITY_GRAPH.json"
      ]
    }
  ],
  "requiredOutputs": [
    {
      "artifact": "phases/phase-4/resources/PHASE4_MANUAL_COVERAGE_CANDIDATE_REGISTRY.md",
      "role": "COMPLETE_MANUAL_COVERAGE",
      "required": true
    },
    {
      "artifact": "shared/controller/SECURITY_TRACEABILITY_GRAPH.json",
      "role": "LIVE_GLOBAL_STATE",
      "required": true
    },
    {
      "artifact": "shared/controller/CARRIED_FORWARD_OBLIGATION_LEDGER.json",
      "role": "LIVE_GLOBAL_STATE",
      "required": true
    }
  ],
  "globalControlCheckpoints": {
    "securityTraceabilityGraph": "UPDATE_LIVE_NO_SEGMENT_SEAL",
    "carriedForwardObligationLedger": "UPDATE_LIVE_NO_SEGMENT_SEAL",
    "evidenceInvalidationMatrix": "CLASSIFY_ONLY_IF_CHANGE_OBSERVED",
    "sealAtCombinedPhase5": true
  },
  "sealingCriteria": [
    "Every in-scope contract and material reachable function is covered",
    "Every activated material domain has evidence or a typed blocker",
    "Every material observation has a traceable disposition",
    "The principal manual review used one multi-lens semantic source traversal; any repeated source reading is bounded to documented unresolved anchors rather than whole-contract lens-by-lens rereads."
  ],
  "recoveryRoutes": [
    {
      "condition": "Coverage gap",
      "route": "Complete only the missing coverage"
    },
    {
      "condition": "New trigger fact",
      "route": "Reevaluate only affected domain classifications"
    },
    {
      "condition": "Material identity change",
      "route": "Classify invalidation and rebind affected evidence"
    }
  ],
  "allowedNextStates": [
    "LITE_PHASE5_ACTIVE"
  ],
  "domainApplicability": {
    "classificationRequiredHere": false,
    "executionRequiredFor": [
      "TRIGGERED",
      "UNCERTAIN_INCLUDE"
    ],
    "recheckPolicy": "ONLY_ON_TRIGGER_FACT_CHANGE"
  },
  "universalRuleIds": [
    "U-EXEC-001",
    "U-GITHUB-001",
    "U-STATE-001",
    "U-EVIDENCE-001",
    "U-REPAIR-001",
    "U-HUMAN-001",
    "U-DISCLOSURE-001",
    "U-SOURCEINTEL-001",
    "U-UPDATES-001",
    "U-HUMANCOMMS-001"
  ]
}
