{
  "schemaVersion": "audit-v7-phase-contract-v1",
  "phase": {
    "sequence": 0,
    "id": "phase-0",
    "title": "Audit Admission, Source Identity, Capability Preflight",
    "reviewerLineage": "reviewer-1",
    "phaseCard": "phases/phase-0/START_HERE.md"
  },
  "authorization": {
    "controllerBoundCurrentPhaseRequired": true,
    "exactSourceFenceRequired": true,
    "incomingSuccessorReceipt": null,
    "automaticAdvanceAfterSeal": true,
    "humanApprovalRequired": false
  },
  "inputs": {
    "required": [
      "Exact controller-bound campaign generation",
      "Exact source identity/fence",
      "Current phase/revision and authorized reviewer lineage",
      "Current SECURITY_TRACEABILITY_GRAPH checkpoint",
      "Current CARRIED_FORWARD_OBLIGATION_LEDGER checkpoint",
      "Current EVIDENCE_INVALIDATION_MATRIX authority"
    ],
    "conditional": [
      "Triggered domain ledgers/resources explicitly referenced by active steps",
      "Live deployment/release/fork/remediation artifacts only when the phase card trigger applies"
    ]
  },
  "steps": [
    {
      "step": 1,
      "action": "Resolve or create the exact campaign",
      "instruction": "Use the GitHub connector app only. Follow the homepage campaign-routing procedure; bind exact campaign generation, workspace path, controller branch and source identity.",
      "requirement": "MANDATORY",
      "condition": null,
      "resources": [
        "../../shared/controller/AUDIT_CONTROLLER_AND_GITHUB_PROTOCOL.md"
      ]
    },
    {
      "step": 2,
      "action": "Admit and inventory the source",
      "instruction": "Mechanically stage/inventory the exact source without semantic conclusions; preserve repository/commit or archive digest and extraction evidence.",
      "requirement": "MANDATORY",
      "condition": null,
      "resources": [
        "../../shared/controller/SOLO_AUDIT_STATE.json"
      ]
    },
    {
      "step": 3,
      "action": "Prove instruction and capability readiness",
      "instruction": "Actively prove the GitHub connector can perform a minimal read against both required repositories (`CurveYield2/Audit-Controller` and `CurveYield2/Contract-Automation`), then record controller/GitHub, build/analyzer, fuzz/simulation, durable evidence, and reporting capability. A connected-app status alone is not sufficient proof.",
      "requirement": "MANDATORY",
      "condition": null,
      "resources": [
        "resources/PHASE0_CAPABILITY_PREFLIGHT.md",
        "../../shared/execution/GITHUB_ACTIONS_VIA_GITHUB_APP.md",
        "resources/INSTRUCTION_READ_PROOF.json"
      ]
    },
    {
      "step": 4,
      "action": "Seal Phase 0 state",
      "instruction": "Bind reviewer-1, source fence, current phase/revision and every typed limitation.",
      "requirement": "MANDATORY",
      "condition": null,
      "resources": [
        "../../shared/controller/SOLO_WORKFLOW_STATE_MACHINE.json"
      ]
    },
    {
      "step": 5,
      "action": "Reconcile campaign-global security state",
      "instruction": "Update the canonical Security Traceability Graph for this phase, enumerate and reconcile every obligation due now, add stable OBL-* records for new later-phase work, and freeze current graph/ledger digests for the Phase Report. An OPEN/IN_PROGRESS obligation due in this phase blocks sealing. Classify every material observed change under the Evidence Invalidation Matrix before reusing affected evidence.",
      "requirement": "MANDATORY",
      "condition": null,
      "resources": [
        "../../shared/controller/SECURITY_TRACEABILITY_GRAPH.json",
        "../../shared/controller/CARRIED_FORWARD_OBLIGATION_LEDGER.json",
        "../../shared/controller/EVIDENCE_INVALIDATION_MATRIX.json"
      ]
    },
    {
      "step": 6,
      "action": "File the phase report and auto-advance",
      "instruction": "Seal the required structured artifact/global checkpoints, file the immutable Phase Report, enter AUTO_ADVANCE_READY, and immediately continue into the next same-reviewer phase under the Automatic Phase Advancement Protocol. Do not wait for human approval.",
      "requirement": "MANDATORY",
      "condition": null,
      "resources": [
        "../../shared/reporting/PHASE_REPORT.md",
        "../../shared/controller/AUTOMATIC_PHASE_ADVANCEMENT_PROTOCOL.md"
      ]
    }
  ],
  "requiredOutputs": [
    {
      "artifact": "phases/phase-0/resources/PHASE0_CAPABILITY_PREFLIGHT.md",
      "role": "PHASE_SPECIFIC_STRUCTURED_FILING",
      "required": true
    },
    {
      "artifact": "shared/controller/SECURITY_TRACEABILITY_GRAPH.json",
      "role": "CAMPAIGN_GLOBAL_CHECKPOINT_TEMPLATE; campaign-local graph digest required",
      "required": true
    },
    {
      "artifact": "shared/controller/CARRIED_FORWARD_OBLIGATION_LEDGER.json",
      "role": "CAMPAIGN_GLOBAL_CHECKPOINT_TEMPLATE; campaign-local ledger digest required",
      "required": true
    },
    {
      "artifact": "shared/reporting/PHASE_REPORT.md",
      "role": "PHASE_REPORT_TEMPLATE",
      "required": true
    },
    {
      "artifact": "phases/phase-0/resources/INSTRUCTION_READ_PROOF.json",
      "role": "PHASE_SPECIFIC_REQUIRED_OUTPUT",
      "required": true
    }
  ],
  "globalControlCheckpoints": {
    "securityTraceabilityGraph": {
      "template": "shared/controller/SECURITY_TRACEABILITY_GRAPH.json",
      "requiredBeforeEvidenceSealed": true,
      "phaseRequirement": [
        "Initialize graph and add SOURCE-* campaign/source identity root."
      ],
      "phaseReportDigestReferenceRequired": true
    },
    "carriedForwardObligationLedger": {
      "template": "shared/controller/CARRIED_FORWARD_OBLIGATION_LEDGER.json",
      "requiredBeforeEvidenceSealed": true,
      "phaseStartDueObligationEnumerationRequired": true,
      "phaseEndDueObligationReconciliationRequired": true,
      "openOrInProgressDueObligationBlocksSeal": true,
      "phaseReportDigestReferenceRequired": true
    },
    "evidenceInvalidationMatrix": {
      "authority": "shared/controller/EVIDENCE_INVALIDATION_MATRIX.json",
      "requiredBeforeEvidenceSealed": true,
      "materialChangeClassificationRequired": true,
      "noChangeDisposition": "NO_MATERIAL_CHANGE_EVENT",
      "invalidatesOrRebindCreatesTraceabilityInvNode": true,
      "unresolvedRetestCreatesObligation": true
    }
  },
  "sealingCriteria": [
    "All mandatory phase-card steps completed or have a permitted typed terminal limitation/failure disposition.",
    "Phase-specific structured filing is complete, exact-source-bound, durable, and digest-referenced.",
    "Security Traceability Graph is updated for this phase and its current campaign-local digest/reference is recorded.",
    "All obligations due in this phase are reconciled in the canonical obligation ledger; no due OPEN/IN_PROGRESS obligation remains.",
    "Every new later-phase obligation has a stable OBL-* ID and objective completion condition.",
    "Phase Report references phase-specific artifact, traceability graph checkpoint, obligation ledger checkpoint, evidence, limitations, and invalidation triggers.",
    "Required process failures have exhausted repair/retry/recovery or are repaired and verified; silent omission is forbidden.",
    "Every material observed change event is classified under EVIDENCE_INVALIDATION_MATRIX; INVALIDATES/REQUIRES_REBIND work is replaced, reconciled, or carried as a typed OBL-* before sealing."
  ],
  "recoveryRoutes": [
    {
      "condition": "GitHub connector unavailable",
      "resource": "SKILL.md#something-broke--recovery-router"
    },
    {
      "condition": "Controller/campaign/evidence/reporting failure",
      "resource": "shared/lenses/operations-recovery-lens.md"
    },
    {
      "condition": "Technical execution/tool/RPC failure",
      "resource": "shared/execution/EXECUTION_PREFLIGHT_AND_REPAIR_PROTOCOL.md"
    },
    {
      "condition": "Source/release identity change",
      "resource": "shared/policy/PROCESS_INTEGRITY_LEDGER.md"
    }
  ],
  "allowedNextStates": [
    "EVIDENCE_SEALED",
    "PHASE_REPORT_SUBMITTED",
    "AUTO_ADVANCE_READY"
  ],
  "domainApplicability": {
    "matrix": "shared/controller/DOMAIN_APPLICABILITY_MATRIX.json",
    "campaignRegistryTemplate": "shared/controller/DOMAIN_APPLICABILITY_REGISTRY.json",
    "mode": "REFERENCE_ONLY_UNTIL_PHASE3",
    "uncertainPolicy": "UNCERTAIN_INCLUDE_IS_TREATED_AS_TRIGGERED",
    "phaseReportDigestReferenceRequired": false
  },
  "universalRuleIds": [
    "U-EXEC-001",
    "U-GITHUB-001",
    "U-STATE-001",
    "U-EVIDENCE-001",
    "U-REPAIR-001",
    "U-HUMAN-001",
    "U-DISCLOSURE-001",
    "U-SOURCEINTEL-001",
    "U-UPDATES-001",
    "U-HUMANCOMMS-001"
  ]
}
